link,next,text,title
[<200 https://trashbox.ru/link/xiaomi-cyberdog-smart-home>],445,"Компания Xiaomi впервые представила свой прототип-конкурент четвероногого робота Boston Dynamics Spot в августе 2021 года. И хотя с тех пор новинка явно не завоевала мир, робота множество раз демонстрировали на выставках и мероприятиях китайского технологического гиганта. Мне же дважды довелось лично поприветствовать CyberDog от Xiaomi — сначала на MWC 2022, а затем и на презентации Xiaomi 12 Pro. И это, безусловно, произвело на меня неизгладимое впечатление.,Прежде чем углубиться в тему подобных устройств, нам нужно разобраться в том, что же такое CyberDog. Собственно, это продвинутый робот на четырёх «ногах», который очень похож на собаку и при этом начинён внушительным набором дорогостоящей электроники. Робот способен самостоятельно ориентироваться в пространстве и работает от встроенной батареи, которой хватает примерно на полчаса непрерывного использования. Да, хотелось бы намного больше, но для прототипа это вполне нормально.,CyberDog работает на «суперкомпьютере», оптимизированном для работы с искусственным интеллектом — речь про платформу NVIDIA Jetson Xavier NX, состоящую из множества вычислительных ядер, процессоров и механизмов глубокого машинного обучения. Данная платформа получает и обрабатывает информацию с 11 датчиков, включая камеры, модули GPS, сенсорные и ультразвуковые датчики. Стоит отметить, что камеры, которые поставляются напрямую от подразделения технологий по обработке изображений Xiaomi, состоят из множества датчиков изображения с датчиками глубины, объективами типа «рыбий глаз» и камер, специально оптимизированных для искусственного интеллекта. Они помогают роботу CyberDog анализировать окружающую среду и создавать навигационные карты в режиме реального времени, избегая при этом препятствий на своём пути.,Представители компании Xiaomi даже обещают, что пользователь, теоретически, сможет взаимодействовать с CyberDog при помощи своего голоса. Для активации функции нужно будет сказать фразу, похожую на «Окей, Google», чтобы робот не слушал голос пользователя всё время. Кроме того, у разработчиков всегда будет возможность дополнительно настроить своего робота благодаря трём портам USB Type-C и выходу HDMI — можно будет добавлять различные модули вроде экранов, элементов освещения, камер, LiDAR и так далее.,Естественно, всё это звучит невероятно многообещающе, но на текущий момент CyberDog всё ещё находится на ранней стадии разработки. Например, в процессе наглядной демонстрации действия робота почти полностью контролировались оператором, что, конечно же, полностью лишило гаджет хоть какой-либо автономности (это необходимо, чтобы убедиться, что он не опрокинется). Управляется робот при помощи двух виртуальных джойстиков в приложении для Android, которое также предоставляет доступ к дополнительным кнопкам, предварительно запрограммированным под шаблонные действия — повернуться, встать, сесть, лечь, подать лапу и всё в таком духе.,Несмотря на то что все вышеперечисленные действия являются заранее запрограммированными движениями, роботу всё равно приходится самостоятельно поддерживать равновесие на местности, с которой он ранее не был знаком, так что даже в этом случае в фоновом режиме происходит множество сложных операций.,К примеру, если слегка толкнуть робота, он будет работать против приложенной к нему неожиданной силы и попытается сохранить своё вертикальное положение, а как только вы перестанете прикладывать силу, он полностью восстановит равновесие без какого-либо вмешательства. На технологическом уровне это достаточно важный механизм, который необходимо продумать перед тем, как переходить к полностью автономной работе. Поэтому было приятно видеть, насколько надёжным робот оказался уже сейчас. И некоторые из предварительно запрограммированных движений выглядят весьма забавно и достаточно реалистично — например, когда маленькая роботизированная собака даёт вам лапу или позволяет её погладить.,Мне даже удалось испытать одну из наиболее продвинутых функций CyberDog, которая доступна на текущий момент. Используя свои камеры и интеллектуальный алгоритм, робота можно перевести в режим слежения, когда устройство следует за конкретным человеком на определённом расстоянии. Эта функция работала весьма достойно в течение минуты или около того — CyberDog медленно следовал за мной, успешно идентифицируя нужного человека в небольшой группе людей.,Впрочем, как бы это ни впечатляло на технологическом уровне, Xiaomi предстоит ещё много работы. И хорошо, что CyberDog лишь отдалённо напоминает настоящую живую собаку, так как всё, что больше похоже на реальное животное, будет вызывать у пользователя лишь мурашки. Например, движения CyberDog отдалённо напоминают собачьи, но они всё равно механические и роботизированные — в противном случае, если бы Xiaomi создала более реалистичного питомца, это могло бы вас напугать. В этом направлении китайскому гиганту ещё предстоит немало поработать, но, честно говоря, Spot от Boston Dynamics выглядит ничуть не более естественным, чем CyberDog.,Компании Xiaomi также ещё предстоит выяснить, что она на самом деле хочет делать с CyberDog, если робот вообще когда-либо станет продуктом, который отправится на потребительский рынок. В долгосрочной перспективе компания могла бы предложить робота жителям домов и квартир, чтобы он бродил по территории и условно охранял её от непрошенных гостей. Или же устройство могло бы стать компаньоном для пожилых людей, который будет автоматически звонить врачу или близкому человеку в критической ситуации. Это всего пара идей из числа огромного множества. И сейчас компания Xiaomi в значительной степени полагается на отзывы разработчиков и сотрудников университетов о том, какие могут быть реальные варианты использования CyberDog.,CyberDog — одно из тех устройств, которые компании создают просто для того, чтобы посмотреть и узнать, станет ли оно когда-либо полноценным жизнеспособным продуктом для массового рынка. Это позволяет проверить почву на тот случай, если какой-то конкурент неожиданно предложит нечто подобное. Чтобы понять этот подход, достаточно посмотреть на все те компании, которые активно выходят на рынок AR и VR — сколько ещё в этой сфере нереализованных идей.,Ясно, что робот Spot от Boston Dynamics, с большой долей вероятности, послужил источником вдохновения для Xiaomi, и в компании подумали: «А что, если бы мы могли сделать его дешевле и на самом деле передать его в руки обычных людей?». Хотя сейчас ещё лишь обсуждается то, будет ли подобный робот когда-то бродить по нашим домам вместе с настоящими домашними животными, удивительно, насколько быстро подобная технология может превратиться из невероятно дорогой (дороже, чем автомобиль) в потенциально доступный элемент умного дома.,Кто знает, может быть в обозримом будущем у нас будут роботы-собаки, работающие под управлением операционной системы Android весь день, вместо этих скучных старых смартфонов. Я, например, одновременно и напуган, и заинтригован этой идеей.",Я дважды поиграл с роботом-собакой от Xiaomi. Теперь хочу такую
