next,text,title
445,"Довольно часто режиссёры голливудских фильмов напрочь забывают о логике и даже самых базовых законах физики во имя красивой картинки, напряжённых сцен и красочного экшна. Прыжки на автомобилях с трамплинов без единого повреждения ходовой, выдёргивание чеки гранаты зубами, удары металлическими предметами без существенных ушибов или даже лошади в открытом космосе — что-то из этого фанаты западных блокбастеров точно видели. Но есть киношные штампы, которые пользуются невероятным спросом в кинематографе и появляются буквально в каждом боевике, хотя на самом деле являются невероятно нелепыми — о них сегодня и поговорим., ,Отважные герои, среди которых, чаще всего, встречаются грабители банков или шпионы, демонстрируют невероятную ловкость и физическую подготовку, уклоняясь от лазерных лучей.,Подобные сцены, безусловно, выглядят очень интригующе, но на самом деле лазерные лучи человеческому глазу не видны — заметить лазер можно лишь в том случае, если он отражается от какой-либо поверхности. Увидеть проходящий перед героем лазер можно лишь в случае распыления какого-либо спрея или газа, но лишь на короткий промежуток времени и, конечно же, не так чётко, как показывают в Голливуде.,Голливудские боевики приучили зрителя к мысли о том, что выстрел из пистолета с накрученным глушителем совершенно бесшумный. Например, главный герой может легко снимать врагов одного за другим, не поднимая тревоги, хотя оппоненты находятся на расстоянии пары метров друг от друга.,Возможно, вы удивитесь, но на самом деле глушитель предназначен в большей степени для защиты слуха стрелка, особенно если вести огонь приходится в закрытых помещениях, нежели для маскировки самого выстрела. Дело в том, что среднестатистический пистолет при выстреле издаёт шум на уровне 160 дБ, тогда как выстрел с глушителем снижает шум до 130 дБ. Это примерно звук, который издаёт отбойный молоток при одном ударе по бетону — услышать его, естественно, можно на внушительном расстоянии, и уж точно его нельзя скрыть при ведении огня в помещении.,Ещё со времён «Крепкого орешка» режиссёры Голливуда взяли привычку прятать своих главных героев в воздуховоде (условная труба квадратной формы, которая является частью вентиляционной системы здания), демонстрируя совершенно бесшумное и незаметное перемещение над головами врагов. Иногда герою удаётся даже проследить за злодеями через решётку, оставаясь незамеченным.,Главная проблема данной уловки кинематографа в весе героя — подобные вентиляционные системы изготавливаются из довольно тонких листов металла, так что вся конструкция просто не рассчитана на то, что внутри неё будет ползать человек. Воздуховод просто завалится вместе с отважным персонажем внутри него. Более того, на самом деле труба воздуховода даже на промышленных объектах не такая большая, чтобы кто-либо смог туда втиснуться, да и про бесшумное перемещение тоже говорить не приходится — шума от ползания внутри пустой вентиляционной трубы было бы очень много.,Достаточно часто крутые персонажи голливудских боевиков пренебрегают выходом через дверь, предпочитая эффектно прыгнуть в окно, выбив его без какого-либо сожаления. После, конечно же, с парой царапин или вовсе без них, можно смело продолжать побег от врагов.,В Голливуде для подобных трюков обычное стекло заменяют хрупким материалом из сахара — прыжок в него не наносит вреда здоровью и порезов, да и само «стекло» легко разбить даже без особых усилий. Прыжок в настоящее стекло, даже в довольно тонкое, закончилось бы для человека множественными порезами и травмами, что уж говорить о попытках прыгнуть и пробить своим телом многослойный стеклопакет. После подобного трюка бежать дальше человек уже не сможет.,Несчётное количество раз персонажи голливудских фильмов спасались бегством посредством прыжка в воду с огромной высоты. Прыжок с моста, проезжающего над рекой поезда или обрыва — одно из самых популярных киношных клише, позволяющее герою в последний момент улизнуть от гибели или поимки злодеями.,Вода, безусловно, способна смягчить падение с определённой высоты, но речь идёт о паре-тройке метров. Всё дело в поверхностном натяжении, которое при определённых обстоятельствах (вроде падения с высоты десяти и более метров) делает воду такой же твёрдой, как бетон. Собственно, спортсмены, которые занимаются прыжками в воду с экстремальной высоты, сравнивают погружение как раз с пробитием бетона ногами — даже соблюдая специальную технику и имея высокую физическую подготовку, пережить подобное крайне тяжело.,Бензин (не в обиду дизелю) является ценнейшим ресурсом во всех фильмах, связанных с постапокалипсисом. При этом главный герой, естественно, может найти брошенный много лет назад автомобиль, сесть в него, завести транспортное средство и поехать по своим делам, попутно ещё и найдя на каком-то складе канистру с подходящим топливом, либо же вовсе взломает бензоколонку.,Стоит учитывать, что абсолютно любой автомобиль нужно обслуживать, чтобы он ездил — как минимум аккумулятор разрядится от долгого простоя (особенно при низких температурах). Но даже если упустить этот момент, нужно понимать, что бензин в бензобаке автомобиля сохраняет свои свойства в течение трёх-шести месяцев. После этого ездить на таком топливе будет почти или вовсе невозможно, так что автомобиль с полным баком, брошенный год назад, остаётся бесполезным куском металла.,Шпионы, специальные агенты и прочие меткие стрелки часто подрывают выстрелом из пистолета или автомата буквально что угодно — от автомобилей, баллонов с газом и бочек с бензином до ядерных бомб.,Для того чтобы взорвать или хотя бы поджечь автомобиль или бочку с бензином, нужно автоматическое оружие с высокой начальной скоростью полёта пули и зажигательные патроны — пистолет в этом случае подходит крайне плохо, да и не каждый автомат справится. Совладать с пропаном тоже сложно — банальной искры в данном случае недостаточно. Про подрыв взрывчатки посредством выстрела тоже мечтать не приходится — для этого нужен взрыватель. И подорвать ядерную бомбу, даже если удастся пробить корпус, естественно, нереально — детонация подобных видов вооружения требует куда более сложных механизмов.,Практически в любом фильме, посвящённом космическим путешествиям, можно увидеть так называемые прыжки, во время которых космический корабль преодолевает огромные расстояния, а звёзды, по мнению режиссёров, вытягиваются в светящиеся линии. Особенно этим грешат «Звёздные войны», но, стоит сказать, визуальный эффект взяли на вооружение многие кинокомпании.,Начать стоит с того, что разогнать космический корабль до скорости света и при этом выжить уже задача, мягко скажем, не из простых. Тем более проблематично разогнаться до скорости, которая выше световой — это невозможно с точки зрения физики. Но даже если бы это было возможно, звёзды не превратились бы в вытянутые точки — вместо этого свет, который эти звёзды излучают, разделился бы на синий и фиолетовый впереди космического судна, и красный — позади него. Также вокруг корабля возникали бы световые аберрации и искажения пространства, но всё это, несомненно, сложнее показать зрителю в кадре, чем просто вытянутые полосы света.,Опытные хакеры на экране голливудского фильма могут взломать Пентагон, любую защитную систему, открыть все двери, украсть миллионы долларов с банковских счетов или даже подчинить себе спутник за несколько секунд или в худшем случае минут.,Любая успешная хакерская атака является результатом длительного процесса подготовки, сбора данных, поиска критичных уязвимостей и способов их использования. Даже самым продвинутым хакерским организациям требуются дни и недели, чтобы добиться желаемого, а некоторые системы по интернету взломать попросту невозможно — для этого нужен физический доступ к серверу. И, конечно, никаких красивых бегущих строк и ярких иконок на экране у хакера нет — там всё куда более скучно и прозаично.,Персонажу фильма достаточно приложить ткань, пропитанную хлороформом, к лицу цели на несколько секунд, чтобы человек потерял сознание — очень удобно для тихого проникновения или похищения.,На самом деле хлороформ не настолько вредоносен — чистое вещество нужно вдыхать 3-5 минут, чтобы человек действительно потерял сознание, да и после этого нужно продолжать подавать его жертве, чтобы она не пришла в себя. В худшем случае, если смешать хлороформ, спирт и прочие химические вещества, человеку просто станет плохо — появятся приступы тошноты, но не более.,Космический экшн без сражений на звездолётах обойтись просто не может — это выглядит крайне эпично, насыщенно и захватывающе, особенно если речь идёт о длительных полётах на скоростных истребителях.,У космических баталий есть сразу несколько проблем. Первая — крупные корабли просто не могут существовать, так как чем больше масса корабля, тем больше нужно топлива, чтобы его оторвать от планеты или разогнать в космосе. Соответственно, для огромного корабля нужен огромный «бензобак», что не позволит такому кораблю взлететь. Но даже если допустить, что топливо стало невероятно лёгким, взрывы в открытом космосе всё равно не были бы такими эпичными — в космосе нет кислорода, так что ничего гореть там не будет.,Сцена с падением и последующим погружением персонажа под лаву выглядит весьма зрелищно и слегка ужасает.,Тот редкий случай, когда ситуация в реальном мире была бы куда более неприятной, чем то, что показывают в кино. Дело в том, что лава на самом деле достаточно плотная субстанция (в три раза плотнее воды), так что человек, упав на лаву, не нырнул бы в неё с головой. Вместо этого тело просто лежало бы поверх раскалённого вещества, медленно сгорая при огромной температуре. ,Главный герой (или его оппонент), оказываясь в сложной ситуации, просто достаёт пистолет, делает пару выстрелов по замку, после чего спокойно открывает дверь и движется к цели.,Стрелять из пистолета по навесному замку — крайне глупая идея, ведь пуля может легко срикошетить в самого стрелка. Более того, нанести существенный урон пулей, выпущенной из пистолета, дужке замка или его корпусу просто нереально — для этого нужно использовать либо очень крупный калибр, либо заряд твёрдой дроби.,Почти всегда персонажа кинокартины, у которого по различным причинам остановилось сердце, можно оживить несколькими ударами дефибриллятора.,Стоит сразу сказать, что в реальной жизни дефибриллятор для реанимации остановившегося сердца не используют — он попросту не может запустить важнейший орган человека. На самом деле дефибриллятор применяется для восстановления нормального сердцебиения — это необходимо, если по каким-то причинам сердце начало работать неправильно.,Взрывчатый элемент, множество цветных проводов и таймер с яркими цифрами — классическое представление Голливуда о бомбе. И, конечно же, останавливают таймер всегда за секунду до взрыва, чтобы напряжение было максимальное.,На самом деле бомбы с таймером — довольно редкое явление в реальном мире, так как точно рассчитать необходимый момент взрывы почти невозможно. Чаще бомбу взрывают удалённо с детонатора. Более того, цветные провода никто не использует — если они вообще нужны, то всегда будут одного и того же цвета. Того, который был в наличии. И, безусловно, таймер с огромными цифрами никто не ставит, так как это ненужный декоративный элемент, требующий дополнительных ресурсов и времени.","15 явлений в кино, которые Голливуд сильно приукрашивает. Лазеры — серьёзно?"
